
==================================================
Processing train split
==================================================
Processing 160 new examples
Labeling train:   0%|          | 0/160 [00:00<?, ?it/s]Labeling train:   1%|          | 1/160 [00:07<20:07,  7.60s/it]Labeling train:   1%|▏         | 2/160 [00:13<17:37,  6.69s/it]Labeling train:   2%|▏         | 3/160 [00:19<16:41,  6.38s/it]Labeling train:   2%|▎         | 4/160 [00:25<16:16,  6.26s/it]Labeling train:   3%|▎         | 5/160 [00:32<16:25,  6.36s/it]Labeling train:   4%|▍         | 6/160 [00:38<16:04,  6.26s/it]Labeling train:   4%|▍         | 7/160 [00:44<15:58,  6.27s/it]Labeling train:   5%|▌         | 8/160 [00:50<15:41,  6.20s/it]Labeling train:   6%|▌         | 9/160 [00:57<15:45,  6.26s/it]Labeling train:   6%|▋         | 10/160 [01:03<15:36,  6.24s/it]Labeling train:   7%|▋         | 11/160 [01:09<15:21,  6.19s/it]Labeling train:   8%|▊         | 12/160 [01:15<15:11,  6.16s/it]Labeling train:   8%|▊         | 13/160 [01:21<15:05,  6.16s/it]Labeling train:   9%|▉         | 14/160 [01:27<14:54,  6.13s/it]Labeling train:   9%|▉         | 15/160 [01:33<14:48,  6.13s/it]Labeling train:  10%|█         | 16/160 [01:39<14:42,  6.13s/it]Labeling train:  11%|█         | 17/160 [01:46<14:53,  6.25s/it]Labeling train:  11%|█▏        | 18/160 [01:52<14:45,  6.24s/it]Labeling train:  12%|█▏        | 19/160 [01:58<14:31,  6.18s/it]Labeling train:  12%|█▎        | 20/160 [02:04<14:25,  6.18s/it]Labeling train:  13%|█▎        | 21/160 [02:11<14:44,  6.37s/it]Labeling train:  14%|█▍        | 22/160 [02:17<14:25,  6.27s/it]Labeling train:  14%|█▍        | 23/160 [02:23<14:11,  6.21s/it]Labeling train:  15%|█▌        | 24/160 [02:30<14:34,  6.43s/it]Labeling train:  16%|█▌        | 25/160 [02:36<14:19,  6.37s/it]Labeling train:  16%|█▋        | 26/160 [02:43<14:17,  6.40s/it]Labeling train:  17%|█▋        | 27/160 [02:49<14:00,  6.32s/it]Labeling train:  18%|█▊        | 28/160 [02:56<14:01,  6.38s/it]Labeling train:  18%|█▊        | 29/160 [03:02<13:44,  6.29s/it]Labeling train:  19%|█▉        | 30/160 [03:08<13:37,  6.29s/it]Labeling train:  19%|█▉        | 31/160 [03:14<13:33,  6.31s/it]Labeling train:  20%|██        | 32/160 [03:20<13:15,  6.22s/it]Labeling train:  21%|██        | 33/160 [03:27<13:11,  6.24s/it]Labeling train:  21%|██▏       | 34/160 [03:33<12:58,  6.18s/it]Labeling train:  22%|██▏       | 35/160 [03:39<12:48,  6.15s/it]Labeling train:  22%|██▎       | 36/160 [03:45<12:47,  6.19s/it]Labeling train:  23%|██▎       | 37/160 [03:51<12:44,  6.22s/it]Labeling train:  24%|██▍       | 38/160 [03:57<12:34,  6.19s/it]Labeling train:  24%|██▍       | 39/160 [04:03<12:25,  6.16s/it]Labeling train:  25%|██▌       | 40/160 [04:10<12:19,  6.16s/it]Labeling train:  26%|██▌       | 41/160 [04:16<12:09,  6.13s/it]Labeling train:  26%|██▋       | 42/160 [04:22<12:05,  6.15s/it]Labeling train:  27%|██▋       | 43/160 [04:32<14:28,  7.43s/it]Labeling train:  28%|██▊       | 44/160 [04:38<13:34,  7.02s/it]Labeling train:  28%|██▊       | 45/160 [04:47<14:07,  7.37s/it]Labeling train:  29%|██▉       | 46/160 [04:53<13:18,  7.01s/it]Labeling train:  29%|██▉       | 47/160 [04:59<12:39,  6.72s/it]Labeling train:  30%|███       | 48/160 [05:07<13:08,  7.04s/it]Labeling train:  31%|███       | 49/160 [05:13<12:40,  6.85s/it]Labeling train:  31%|███▏      | 50/160 [05:19<12:16,  6.69s/it]Labeling train:  32%|███▏      | 51/160 [05:26<12:13,  6.73s/it]Labeling train:  32%|███▎      | 52/160 [05:32<11:44,  6.53s/it]Labeling train:  33%|███▎      | 53/160 [05:39<11:34,  6.49s/it]Labeling train:  34%|███▍      | 54/160 [05:45<11:21,  6.42s/it]Labeling train:  34%|███▍      | 55/160 [05:51<11:02,  6.31s/it]Labeling train:  35%|███▌      | 56/160 [05:57<11:01,  6.36s/it]Labeling train:  36%|███▌      | 57/160 [06:03<10:47,  6.29s/it]Labeling train:  36%|███▋      | 58/160 [06:10<10:43,  6.31s/it]Labeling train:  37%|███▋      | 59/160 [06:16<10:29,  6.23s/it]Labeling train:  38%|███▊      | 60/160 [06:23<10:48,  6.49s/it]Labeling train:  38%|███▊      | 61/160 [06:29<10:42,  6.49s/it]Labeling train:  39%|███▉      | 62/160 [06:37<11:00,  6.74s/it]Labeling train:  39%|███▉      | 63/160 [06:44<10:56,  6.77s/it]Labeling train:  40%|████      | 64/160 [06:50<10:41,  6.68s/it]Labeling train:  41%|████      | 65/160 [06:56<10:19,  6.52s/it]Labeling train:  41%|████▏     | 66/160 [07:03<10:10,  6.50s/it]Labeling train:  42%|████▏     | 67/160 [07:09<09:51,  6.36s/it]Labeling train:  42%|████▎     | 68/160 [07:17<10:33,  6.88s/it]Labeling train:  43%|████▎     | 69/160 [07:23<10:02,  6.62s/it]Labeling train:  44%|████▍     | 70/160 [07:30<09:57,  6.64s/it]Labeling train:  44%|████▍     | 71/160 [07:36<09:43,  6.56s/it]Labeling train:  45%|████▌     | 72/160 [07:42<09:25,  6.42s/it]Labeling train:  46%|████▌     | 73/160 [07:48<09:08,  6.31s/it]Labeling train:  46%|████▋     | 74/160 [07:54<08:57,  6.25s/it]Labeling train:  47%|████▋     | 75/160 [08:00<08:49,  6.23s/it]Labeling train:  48%|████▊     | 76/160 [08:09<09:39,  6.90s/it]Labeling train:  48%|████▊     | 77/160 [08:18<10:36,  7.67s/it]Labeling train:  49%|████▉     | 78/160 [08:24<09:47,  7.17s/it]Labeling train:  49%|████▉     | 79/160 [08:31<09:19,  6.90s/it]Labeling train:  50%|█████     | 80/160 [08:37<08:55,  6.70s/it]Labeling train:  51%|█████     | 81/160 [08:43<08:37,  6.55s/it]Labeling train:  51%|█████▏    | 82/160 [08:49<08:20,  6.42s/it]Labeling train:  52%|█████▏    | 83/160 [08:55<08:06,  6.32s/it]Labeling train:  52%|█████▎    | 84/160 [09:02<08:04,  6.38s/it]Labeling train:  53%|█████▎    | 85/160 [09:08<07:59,  6.40s/it]Labeling train:  54%|█████▍    | 86/160 [09:15<07:54,  6.41s/it]Labeling train:  54%|█████▍    | 87/160 [09:21<07:40,  6.30s/it]Labeling train:  55%|█████▌    | 88/160 [09:27<07:36,  6.34s/it]Labeling train:  56%|█████▌    | 89/160 [09:33<07:27,  6.30s/it]Labeling train:  56%|█████▋    | 90/160 [09:42<08:20,  7.15s/it]Labeling train:  57%|█████▋    | 91/160 [09:50<08:17,  7.21s/it]Labeling train:  57%|█████▊    | 92/160 [09:56<07:51,  6.94s/it]Labeling train:  58%|█████▊    | 93/160 [10:02<07:24,  6.64s/it]Labeling train:  59%|█████▉    | 94/160 [10:08<07:08,  6.49s/it]Labeling train:  59%|█████▉    | 95/160 [10:14<06:55,  6.39s/it]Labeling train:  60%|██████    | 96/160 [10:22<07:16,  6.82s/it]Labeling train:  61%|██████    | 97/160 [10:29<07:14,  6.89s/it]Labeling train:  61%|██████▏   | 98/160 [10:35<06:54,  6.69s/it]Labeling train:  62%|██████▏   | 99/160 [10:41<06:36,  6.51s/it]Labeling train:  62%|██████▎   | 100/160 [10:49<06:45,  6.76s/it]Labeling train:  63%|██████▎   | 101/160 [10:55<06:27,  6.57s/it]Labeling train:  64%|██████▍   | 102/160 [11:01<06:16,  6.48s/it]Labeling train:  64%|██████▍   | 103/160 [11:08<06:09,  6.49s/it]Labeling train:  65%|██████▌   | 104/160 [11:14<06:01,  6.45s/it]Labeling train:  66%|██████▌   | 105/160 [11:20<05:51,  6.39s/it]Labeling train:  66%|██████▋   | 106/160 [11:27<05:44,  6.37s/it]Labeling train:  67%|██████▋   | 107/160 [11:33<05:35,  6.32s/it]Labeling train:  68%|██████▊   | 108/160 [11:39<05:28,  6.31s/it]Labeling train:  68%|██████▊   | 109/160 [11:46<05:22,  6.32s/it]Labeling train:  69%|██████▉   | 110/160 [11:52<05:16,  6.32s/it]Labeling train:  69%|██████▉   | 111/160 [11:58<05:06,  6.25s/it]Labeling train:  70%|███████   | 112/160 [12:04<05:00,  6.26s/it]Labeling train:  71%|███████   | 113/160 [12:11<05:06,  6.52s/it]Labeling train:  71%|███████▏  | 114/160 [12:17<04:54,  6.41s/it]Labeling train:  72%|███████▏  | 115/160 [12:24<04:47,  6.39s/it]Labeling train:  72%|███████▎  | 116/160 [12:31<04:52,  6.64s/it]Labeling train:  73%|███████▎  | 117/160 [12:42<05:37,  7.84s/it]Labeling train:  74%|███████▍  | 118/160 [12:48<05:06,  7.31s/it]Labeling train:  74%|███████▍  | 119/160 [12:54<04:44,  6.93s/it]Labeling train:  75%|███████▌  | 120/160 [13:01<04:42,  7.06s/it]Labeling train:  76%|███████▌  | 121/160 [13:07<04:24,  6.78s/it]Labeling train:  76%|███████▋  | 122/160 [13:13<04:09,  6.57s/it]Labeling train:  77%|███████▋  | 123/160 [13:20<03:58,  6.44s/it]Labeling train:  78%|███████▊  | 124/160 [13:26<03:47,  6.32s/it]Labeling train:  78%|███████▊  | 125/160 [13:35<04:10,  7.16s/it]Labeling train:  79%|███████▉  | 126/160 [13:41<03:53,  6.86s/it]Labeling train:  79%|███████▉  | 127/160 [13:47<03:38,  6.62s/it]Labeling train:  80%|████████  | 128/160 [13:54<03:36,  6.77s/it]Labeling train:  81%|████████  | 129/160 [14:00<03:25,  6.62s/it]Labeling train:  81%|████████▏ | 130/160 [14:06<03:14,  6.47s/it]Labeling train:  82%|████████▏ | 131/160 [14:12<03:04,  6.35s/it]Labeling train:  82%|████████▎ | 132/160 [14:21<03:20,  7.15s/it]Labeling train:  83%|████████▎ | 133/160 [14:28<03:07,  6.95s/it]Labeling train:  84%|████████▍ | 134/160 [14:34<02:57,  6.81s/it]Labeling train:  84%|████████▍ | 135/160 [14:42<02:55,  7.02s/it]Labeling train:  85%|████████▌ | 136/160 [14:48<02:42,  6.79s/it]Labeling train:  86%|████████▌ | 137/160 [14:54<02:30,  6.56s/it]Labeling train:  86%|████████▋ | 138/160 [15:00<02:21,  6.44s/it]Labeling train:  87%|████████▋ | 139/160 [15:07<02:13,  6.35s/it]Labeling train:  88%|████████▊ | 140/160 [15:13<02:06,  6.33s/it]Labeling train:  88%|████████▊ | 141/160 [15:19<01:59,  6.29s/it]Labeling train:  89%|████████▉ | 142/160 [15:25<01:52,  6.25s/it]Labeling train:  89%|████████▉ | 143/160 [15:31<01:45,  6.22s/it]Labeling train:  90%|█████████ | 144/160 [15:37<01:39,  6.20s/it]Labeling train:  91%|█████████ | 145/160 [15:44<01:33,  6.21s/it]Labeling train:  91%|█████████▏| 146/160 [15:50<01:26,  6.19s/it]Labeling train:  92%|█████████▏| 147/160 [15:56<01:20,  6.18s/it]Labeling train:  92%|█████████▎| 148/160 [16:02<01:15,  6.26s/it]Labeling train:  93%|█████████▎| 149/160 [16:08<01:08,  6.20s/it]Labeling train:  94%|█████████▍| 150/160 [16:15<01:02,  6.27s/it]Labeling train:  94%|█████████▍| 151/160 [16:21<00:56,  6.24s/it]Labeling train:  95%|█████████▌| 152/160 [16:27<00:50,  6.27s/it]Labeling train:  96%|█████████▌| 153/160 [16:34<00:44,  6.29s/it]Labeling train:  96%|█████████▋| 154/160 [16:40<00:37,  6.31s/it]Labeling train:  97%|█████████▋| 155/160 [16:46<00:31,  6.29s/it]Labeling train:  98%|█████████▊| 156/160 [16:53<00:25,  6.45s/it]Labeling train:  98%|█████████▊| 157/160 [16:59<00:19,  6.34s/it]Labeling train:  99%|█████████▉| 158/160 [17:06<00:13,  6.56s/it]Labeling train:  99%|█████████▉| 159/160 [17:13<00:06,  6.46s/it]Labeling train: 100%|██████████| 160/160 [17:20<00:00,  6.62s/it]Labeling train: 100%|██████████| 160/160 [17:20<00:00,  6.50s/it]

=== train Labeling Statistics ===
Total processed: 160
Small model correct: 12 (7.5%)
Large model correct: 21 (13.1%)
Both correct: 12 (7.5%)
Both wrong: 139 (86.9%)
Label 0 (use Small): 12 (7.5%)
Label 1 (use Large): 148 (92.5%)
✓ Saved 160 examples to data/labeled/train.jsonl

==================================================
Processing validation split
==================================================
Processing 40 new examples
Labeling validation:   0%|          | 0/40 [00:00<?, ?it/s]Labeling validation:   2%|▎         | 1/40 [00:06<03:59,  6.14s/it]Labeling validation:   5%|▌         | 2/40 [00:12<03:50,  6.05s/it]Labeling validation:   8%|▊         | 3/40 [00:19<04:05,  6.63s/it]Labeling validation:  10%|█         | 4/40 [00:25<03:54,  6.52s/it]Labeling validation:  12%|█▎        | 5/40 [00:32<03:45,  6.44s/it]Labeling validation:  15%|█▌        | 6/40 [00:38<03:36,  6.35s/it]Labeling validation:  18%|█▊        | 7/40 [00:44<03:27,  6.29s/it]Labeling validation:  20%|██        | 8/40 [00:50<03:19,  6.24s/it]Labeling validation:  22%|██▎       | 9/40 [00:56<03:12,  6.21s/it]Labeling validation:  25%|██▌       | 10/40 [01:03<03:13,  6.46s/it]Labeling validation:  28%|██▊       | 11/40 [01:10<03:09,  6.54s/it]Labeling validation:  30%|███       | 12/40 [01:16<02:59,  6.42s/it]Labeling validation:  32%|███▎      | 13/40 [01:22<02:50,  6.32s/it]Labeling validation:  35%|███▌      | 14/40 [01:28<02:43,  6.27s/it]Labeling validation:  38%|███▊      | 15/40 [01:35<02:36,  6.24s/it]Labeling validation:  40%|████      | 16/40 [01:41<02:30,  6.28s/it]Labeling validation:  42%|████▎     | 17/40 [01:48<02:28,  6.45s/it]Labeling validation:  45%|████▌     | 18/40 [01:54<02:22,  6.48s/it]Labeling validation:  48%|████▊     | 19/40 [02:00<02:13,  6.35s/it]Labeling validation:  50%|█████     | 20/40 [02:06<02:05,  6.28s/it]Labeling validation:  52%|█████▎    | 21/40 [02:13<02:00,  6.36s/it]Labeling validation:  55%|█████▌    | 22/40 [02:19<01:53,  6.31s/it]Labeling validation:  57%|█████▊    | 23/40 [02:26<01:47,  6.35s/it]Labeling validation:  60%|██████    | 24/40 [02:32<01:40,  6.26s/it]Labeling validation:  62%|██████▎   | 25/40 [02:38<01:33,  6.23s/it]Labeling validation:  65%|██████▌   | 26/40 [02:45<01:31,  6.57s/it]Labeling validation:  68%|██████▊   | 27/40 [02:52<01:24,  6.50s/it]Labeling validation:  70%|███████   | 28/40 [02:58<01:16,  6.39s/it]Labeling validation:  72%|███████▎  | 29/40 [03:05<01:13,  6.72s/it]Labeling validation:  75%|███████▌  | 30/40 [03:11<01:05,  6.55s/it]Labeling validation:  78%|███████▊  | 31/40 [03:17<00:57,  6.42s/it]Labeling validation:  80%|████████  | 32/40 [03:24<00:51,  6.43s/it]Labeling validation:  82%|████████▎ | 33/40 [03:30<00:45,  6.46s/it]Labeling validation:  85%|████████▌ | 34/40 [03:37<00:38,  6.36s/it]Labeling validation:  88%|████████▊ | 35/40 [03:43<00:32,  6.43s/it]Labeling validation:  90%|█████████ | 36/40 [03:49<00:25,  6.32s/it]Labeling validation:  92%|█████████▎| 37/40 [03:55<00:18,  6.26s/it]Labeling validation:  95%|█████████▌| 38/40 [04:01<00:12,  6.21s/it]Labeling validation:  98%|█████████▊| 39/40 [04:07<00:06,  6.17s/it]Labeling validation: 100%|██████████| 40/40 [04:14<00:00,  6.27s/it]Labeling validation: 100%|██████████| 40/40 [04:14<00:00,  6.36s/it]

=== validation Labeling Statistics ===
Total processed: 40
Small model correct: 3 (7.5%)
Large model correct: 5 (12.5%)
Both correct: 2 (5.0%)
Both wrong: 34 (85.0%)
Label 0 (use Small): 3 (7.5%)
Label 1 (use Large): 37 (92.5%)
✓ Saved 40 examples to data/labeled/validation.jsonl
